======================================================================
Model 4 Test Results - 75 Minute Predictions
Generated: 2026-01-31 09:06:03
======================================================================

Accuracy Matrix (k × N):
--------------------------------------------------
k \ N   N=1         N=3         N=5         N=10        N=15        
--------------------------------------------------
k=1     78.47%      76.51%      77.94%      76.87%      77.58%      
k=2     77.40%      75.27%      78.83%      78.83%      79.89%      
k=3     77.05%      78.29%      78.11%      77.94%      77.58%      
k=4     77.40%      75.27%      77.40%      76.87%      76.33%      
--------------------------------------------------

Detailed Results:
======================================================================

======================================================================
Overall Results (pred_min=75, k=1, N=1)
======================================================================
Status: OK
Accuracy: 78.47%

======================================================================
Overall Results (pred_min=75, k=1, N=3)
======================================================================
Status: OK
Accuracy: 76.51%

======================================================================
Overall Results (pred_min=75, k=1, N=5)
======================================================================
Status: OK
Accuracy: 77.94%

======================================================================
Overall Results (pred_min=75, k=1, N=10)
======================================================================
Status: OK
Accuracy: 76.87%

======================================================================
Overall Results (pred_min=75, k=1, N=15)
======================================================================
Status: OK
Accuracy: 77.58%

======================================================================
Overall Results (pred_min=75, k=2, N=1)
======================================================================
Status: OK
Accuracy: 77.40%

======================================================================
Overall Results (pred_min=75, k=2, N=3)
======================================================================
Status: OK
Accuracy: 75.27%

======================================================================
Overall Results (pred_min=75, k=2, N=5)
======================================================================
Status: OK
Accuracy: 78.83%

======================================================================
Overall Results (pred_min=75, k=2, N=10)
======================================================================
Status: OK
Accuracy: 78.83%

======================================================================
Overall Results (pred_min=75, k=2, N=15)
======================================================================
Status: OK
Accuracy: 79.89%

======================================================================
Overall Results (pred_min=75, k=3, N=1)
======================================================================
Status: OK
Accuracy: 77.05%

======================================================================
Overall Results (pred_min=75, k=3, N=3)
======================================================================
Status: OK
Accuracy: 78.29%

======================================================================
Overall Results (pred_min=75, k=3, N=5)
======================================================================
Status: OK
Accuracy: 78.11%

======================================================================
Overall Results (pred_min=75, k=3, N=10)
======================================================================
Status: OK
Accuracy: 77.94%

======================================================================
Overall Results (pred_min=75, k=3, N=15)
======================================================================
Status: OK
Accuracy: 77.58%

======================================================================
Overall Results (pred_min=75, k=4, N=1)
======================================================================
Status: OK
Accuracy: 77.40%

======================================================================
Overall Results (pred_min=75, k=4, N=3)
======================================================================
Status: OK
Accuracy: 75.27%

======================================================================
Overall Results (pred_min=75, k=4, N=5)
======================================================================
Status: OK
Accuracy: 77.40%

======================================================================
Overall Results (pred_min=75, k=4, N=10)
======================================================================
Status: OK
Accuracy: 76.87%

======================================================================
Overall Results (pred_min=75, k=4, N=15)
======================================================================
Status: OK
Accuracy: 76.33%

======================================================================
BEST RESULT for 75 min
======================================================================
Configuration: k=2, N=15
Accuracy: 79.89%
