======================================================================
Model 4 Test Results - 90 Minute Predictions
Generated: 2026-01-31 09:06:03
======================================================================

Accuracy Matrix (k × N):
--------------------------------------------------
k \ N   N=1         N=3         N=5         N=10        N=15        
--------------------------------------------------
k=1     78.65%      79.18%      80.60%      80.43%      80.07%      
k=2     78.11%      79.72%      81.14%      80.78%      80.60%      
k=3     79.54%      78.11%      80.07%      79.54%      80.43%      
k=4     79.36%      77.05%      80.96%      80.60%      77.94%      
--------------------------------------------------

Detailed Results:
======================================================================

======================================================================
Overall Results (pred_min=90, k=1, N=1)
======================================================================
Status: OK
Accuracy: 78.65%

======================================================================
Overall Results (pred_min=90, k=1, N=3)
======================================================================
Status: OK
Accuracy: 79.18%

======================================================================
Overall Results (pred_min=90, k=1, N=5)
======================================================================
Status: OK
Accuracy: 80.60%

======================================================================
Overall Results (pred_min=90, k=1, N=10)
======================================================================
Status: OK
Accuracy: 80.43%

======================================================================
Overall Results (pred_min=90, k=1, N=15)
======================================================================
Status: OK
Accuracy: 80.07%

======================================================================
Overall Results (pred_min=90, k=2, N=1)
======================================================================
Status: OK
Accuracy: 78.11%

======================================================================
Overall Results (pred_min=90, k=2, N=3)
======================================================================
Status: OK
Accuracy: 79.72%

======================================================================
Overall Results (pred_min=90, k=2, N=5)
======================================================================
Status: OK
Accuracy: 81.14%

======================================================================
Overall Results (pred_min=90, k=2, N=10)
======================================================================
Status: OK
Accuracy: 80.78%

======================================================================
Overall Results (pred_min=90, k=2, N=15)
======================================================================
Status: OK
Accuracy: 80.60%

======================================================================
Overall Results (pred_min=90, k=3, N=1)
======================================================================
Status: OK
Accuracy: 79.54%

======================================================================
Overall Results (pred_min=90, k=3, N=3)
======================================================================
Status: OK
Accuracy: 78.11%

======================================================================
Overall Results (pred_min=90, k=3, N=5)
======================================================================
Status: OK
Accuracy: 80.07%

======================================================================
Overall Results (pred_min=90, k=3, N=10)
======================================================================
Status: OK
Accuracy: 79.54%

======================================================================
Overall Results (pred_min=90, k=3, N=15)
======================================================================
Status: OK
Accuracy: 80.43%

======================================================================
Overall Results (pred_min=90, k=4, N=1)
======================================================================
Status: OK
Accuracy: 79.36%

======================================================================
Overall Results (pred_min=90, k=4, N=3)
======================================================================
Status: OK
Accuracy: 77.05%

======================================================================
Overall Results (pred_min=90, k=4, N=5)
======================================================================
Status: OK
Accuracy: 80.96%

======================================================================
Overall Results (pred_min=90, k=4, N=10)
======================================================================
Status: OK
Accuracy: 80.60%

======================================================================
Overall Results (pred_min=90, k=4, N=15)
======================================================================
Status: OK
Accuracy: 77.94%

======================================================================
BEST RESULT for 90 min
======================================================================
Configuration: k=2, N=5
Accuracy: 81.14%
