======================================================================
Model 4 Test Results - 60 Minute Predictions
Generated: 2026-01-31 09:06:03
======================================================================

Accuracy Matrix (k × N):
--------------------------------------------------
k \ N   N=1         N=3         N=5         N=10        N=15        
--------------------------------------------------
k=1     77.94%      78.29%      79.00%      77.94%      79.89%      
k=2     77.40%      77.94%      76.69%      76.33%      75.27%      
k=3     76.87%      77.05%      77.22%      76.69%      75.44%      
k=4     76.51%      77.05%      76.33%      77.05%      76.69%      
--------------------------------------------------

Detailed Results:
======================================================================

======================================================================
Overall Results (pred_min=60, k=1, N=1)
======================================================================
Status: OK
Accuracy: 77.94%

======================================================================
Overall Results (pred_min=60, k=1, N=3)
======================================================================
Status: OK
Accuracy: 78.29%

======================================================================
Overall Results (pred_min=60, k=1, N=5)
======================================================================
Status: OK
Accuracy: 79.00%

======================================================================
Overall Results (pred_min=60, k=1, N=10)
======================================================================
Status: OK
Accuracy: 77.94%

======================================================================
Overall Results (pred_min=60, k=1, N=15)
======================================================================
Status: OK
Accuracy: 79.89%

======================================================================
Overall Results (pred_min=60, k=2, N=1)
======================================================================
Status: OK
Accuracy: 77.40%

======================================================================
Overall Results (pred_min=60, k=2, N=3)
======================================================================
Status: OK
Accuracy: 77.94%

======================================================================
Overall Results (pred_min=60, k=2, N=5)
======================================================================
Status: OK
Accuracy: 76.69%

======================================================================
Overall Results (pred_min=60, k=2, N=10)
======================================================================
Status: OK
Accuracy: 76.33%

======================================================================
Overall Results (pred_min=60, k=2, N=15)
======================================================================
Status: OK
Accuracy: 75.27%

======================================================================
Overall Results (pred_min=60, k=3, N=1)
======================================================================
Status: OK
Accuracy: 76.87%

======================================================================
Overall Results (pred_min=60, k=3, N=3)
======================================================================
Status: OK
Accuracy: 77.05%

======================================================================
Overall Results (pred_min=60, k=3, N=5)
======================================================================
Status: OK
Accuracy: 77.22%

======================================================================
Overall Results (pred_min=60, k=3, N=10)
======================================================================
Status: OK
Accuracy: 76.69%

======================================================================
Overall Results (pred_min=60, k=3, N=15)
======================================================================
Status: OK
Accuracy: 75.44%

======================================================================
Overall Results (pred_min=60, k=4, N=1)
======================================================================
Status: OK
Accuracy: 76.51%

======================================================================
Overall Results (pred_min=60, k=4, N=3)
======================================================================
Status: OK
Accuracy: 77.05%

======================================================================
Overall Results (pred_min=60, k=4, N=5)
======================================================================
Status: OK
Accuracy: 76.33%

======================================================================
Overall Results (pred_min=60, k=4, N=10)
======================================================================
Status: OK
Accuracy: 77.05%

======================================================================
Overall Results (pred_min=60, k=4, N=15)
======================================================================
Status: OK
Accuracy: 76.69%

======================================================================
BEST RESULT for 60 min
======================================================================
Configuration: k=1, N=15
Accuracy: 79.89%
