======================================================================
Model 4 Test Results - 45 Minute Predictions
Generated: 2026-01-31 09:06:03
======================================================================

Accuracy Matrix (k × N):
--------------------------------------------------
k \ N   N=1         N=3         N=5         N=10        N=15        
--------------------------------------------------
k=1     75.09%      76.87%      75.09%      75.80%      75.98%      
k=2     77.22%      76.51%      75.80%      75.80%      76.51%      
k=3     76.69%      75.44%      75.62%      75.44%      74.56%      
k=4     76.51%      76.69%      76.87%      73.13%      ---         
--------------------------------------------------

Detailed Results:
======================================================================

======================================================================
Overall Results (pred_min=45, k=1, N=1)
======================================================================
Status: OK
Accuracy: 75.09%

======================================================================
Overall Results (pred_min=45, k=1, N=3)
======================================================================
Status: OK
Accuracy: 76.87%

======================================================================
Overall Results (pred_min=45, k=1, N=5)
======================================================================
Status: OK
Accuracy: 75.09%

======================================================================
Overall Results (pred_min=45, k=1, N=10)
======================================================================
Status: OK
Accuracy: 75.80%

======================================================================
Overall Results (pred_min=45, k=1, N=15)
======================================================================
Status: OK
Accuracy: 75.98%

======================================================================
Overall Results (pred_min=45, k=2, N=1)
======================================================================
Status: OK
Accuracy: 77.22%

======================================================================
Overall Results (pred_min=45, k=2, N=3)
======================================================================
Status: OK
Accuracy: 76.51%

======================================================================
Overall Results (pred_min=45, k=2, N=5)
======================================================================
Status: OK
Accuracy: 75.80%

======================================================================
Overall Results (pred_min=45, k=2, N=10)
======================================================================
Status: OK
Accuracy: 75.80%

======================================================================
Overall Results (pred_min=45, k=2, N=15)
======================================================================
Status: OK
Accuracy: 76.51%

======================================================================
Overall Results (pred_min=45, k=3, N=1)
======================================================================
Status: OK
Accuracy: 76.69%

======================================================================
Overall Results (pred_min=45, k=3, N=3)
======================================================================
Status: OK
Accuracy: 75.44%

======================================================================
Overall Results (pred_min=45, k=3, N=5)
======================================================================
Status: OK
Accuracy: 75.62%

======================================================================
Overall Results (pred_min=45, k=3, N=10)
======================================================================
Status: OK
Accuracy: 75.44%

======================================================================
Overall Results (pred_min=45, k=3, N=15)
======================================================================
Status: OK
Accuracy: 74.56%

======================================================================
Overall Results (pred_min=45, k=4, N=1)
======================================================================
Status: OK
Accuracy: 76.51%

======================================================================
Overall Results (pred_min=45, k=4, N=3)
======================================================================
Status: OK
Accuracy: 76.69%

======================================================================
Overall Results (pred_min=45, k=4, N=5)
======================================================================
Status: OK
Accuracy: 76.87%

======================================================================
Overall Results (pred_min=45, k=4, N=10)
======================================================================
Status: OK
Accuracy: 73.13%

======================================================================
Overall Results (pred_min=45, k=4, N=15)
======================================================================
Status: MODEL_NOT_FOUND

======================================================================
BEST RESULT for 45 min
======================================================================
Configuration: k=2, N=1
Accuracy: 77.22%
