======================================================================
Model 4 Test Results - 75 Minute Predictions
Generated: 2026-01-30 22:36:02
======================================================================

Accuracy Matrix (k × N):
--------------------------------------------------
k \ N   N=1         N=3         N=5         N=10        N=15        
--------------------------------------------------
k=1     78.83%      79.36%      78.65%      76.33%      79.00%      
k=2     76.87%      78.29%      78.65%      80.96%      78.83%      
k=3     77.58%      77.76%      77.40%      79.36%      77.76%      
k=4     75.98%      75.80%      77.40%      76.87%      77.22%      
--------------------------------------------------

Detailed Results:
======================================================================

======================================================================
Overall Results (pred_min=75, k=1, N=1)
======================================================================
Status: OK
Accuracy: 78.83%

======================================================================
Overall Results (pred_min=75, k=1, N=3)
======================================================================
Status: OK
Accuracy: 79.36%

======================================================================
Overall Results (pred_min=75, k=1, N=5)
======================================================================
Status: OK
Accuracy: 78.65%

======================================================================
Overall Results (pred_min=75, k=1, N=10)
======================================================================
Status: OK
Accuracy: 76.33%

======================================================================
Overall Results (pred_min=75, k=1, N=15)
======================================================================
Status: OK
Accuracy: 79.00%

======================================================================
Overall Results (pred_min=75, k=2, N=1)
======================================================================
Status: OK
Accuracy: 76.87%

======================================================================
Overall Results (pred_min=75, k=2, N=3)
======================================================================
Status: OK
Accuracy: 78.29%

======================================================================
Overall Results (pred_min=75, k=2, N=5)
======================================================================
Status: OK
Accuracy: 78.65%

======================================================================
Overall Results (pred_min=75, k=2, N=10)
======================================================================
Status: OK
Accuracy: 80.96%

======================================================================
Overall Results (pred_min=75, k=2, N=15)
======================================================================
Status: OK
Accuracy: 78.83%

======================================================================
Overall Results (pred_min=75, k=3, N=1)
======================================================================
Status: OK
Accuracy: 77.58%

======================================================================
Overall Results (pred_min=75, k=3, N=3)
======================================================================
Status: OK
Accuracy: 77.76%

======================================================================
Overall Results (pred_min=75, k=3, N=5)
======================================================================
Status: OK
Accuracy: 77.40%

======================================================================
Overall Results (pred_min=75, k=3, N=10)
======================================================================
Status: OK
Accuracy: 79.36%

======================================================================
Overall Results (pred_min=75, k=3, N=15)
======================================================================
Status: OK
Accuracy: 77.76%

======================================================================
Overall Results (pred_min=75, k=4, N=1)
======================================================================
Status: OK
Accuracy: 75.98%

======================================================================
Overall Results (pred_min=75, k=4, N=3)
======================================================================
Status: OK
Accuracy: 75.80%

======================================================================
Overall Results (pred_min=75, k=4, N=5)
======================================================================
Status: OK
Accuracy: 77.40%

======================================================================
Overall Results (pred_min=75, k=4, N=10)
======================================================================
Status: OK
Accuracy: 76.87%

======================================================================
Overall Results (pred_min=75, k=4, N=15)
======================================================================
Status: OK
Accuracy: 77.22%

======================================================================
BEST RESULT for 75 min
======================================================================
Configuration: k=2, N=10
Accuracy: 80.96%
