======================================================================
Model 4 Test Results - 60 Minute Predictions
Generated: 2026-01-30 22:36:02
======================================================================

Accuracy Matrix (k × N):
--------------------------------------------------
k \ N   N=1         N=3         N=5         N=10        N=15        
--------------------------------------------------
k=1     77.76%      78.47%      76.87%      77.94%      78.11%      
k=2     77.22%      76.16%      76.33%      78.29%      76.69%      
k=3     77.76%      76.51%      78.11%      77.05%      75.09%      
k=4     76.87%      77.22%      77.40%      76.33%      77.05%      
--------------------------------------------------

Detailed Results:
======================================================================

======================================================================
Overall Results (pred_min=60, k=1, N=1)
======================================================================
Status: OK
Accuracy: 77.76%

======================================================================
Overall Results (pred_min=60, k=1, N=3)
======================================================================
Status: OK
Accuracy: 78.47%

======================================================================
Overall Results (pred_min=60, k=1, N=5)
======================================================================
Status: OK
Accuracy: 76.87%

======================================================================
Overall Results (pred_min=60, k=1, N=10)
======================================================================
Status: OK
Accuracy: 77.94%

======================================================================
Overall Results (pred_min=60, k=1, N=15)
======================================================================
Status: OK
Accuracy: 78.11%

======================================================================
Overall Results (pred_min=60, k=2, N=1)
======================================================================
Status: OK
Accuracy: 77.22%

======================================================================
Overall Results (pred_min=60, k=2, N=3)
======================================================================
Status: OK
Accuracy: 76.16%

======================================================================
Overall Results (pred_min=60, k=2, N=5)
======================================================================
Status: OK
Accuracy: 76.33%

======================================================================
Overall Results (pred_min=60, k=2, N=10)
======================================================================
Status: OK
Accuracy: 78.29%

======================================================================
Overall Results (pred_min=60, k=2, N=15)
======================================================================
Status: OK
Accuracy: 76.69%

======================================================================
Overall Results (pred_min=60, k=3, N=1)
======================================================================
Status: OK
Accuracy: 77.76%

======================================================================
Overall Results (pred_min=60, k=3, N=3)
======================================================================
Status: OK
Accuracy: 76.51%

======================================================================
Overall Results (pred_min=60, k=3, N=5)
======================================================================
Status: OK
Accuracy: 78.11%

======================================================================
Overall Results (pred_min=60, k=3, N=10)
======================================================================
Status: OK
Accuracy: 77.05%

======================================================================
Overall Results (pred_min=60, k=3, N=15)
======================================================================
Status: OK
Accuracy: 75.09%

======================================================================
Overall Results (pred_min=60, k=4, N=1)
======================================================================
Status: OK
Accuracy: 76.87%

======================================================================
Overall Results (pred_min=60, k=4, N=3)
======================================================================
Status: OK
Accuracy: 77.22%

======================================================================
Overall Results (pred_min=60, k=4, N=5)
======================================================================
Status: OK
Accuracy: 77.40%

======================================================================
Overall Results (pred_min=60, k=4, N=10)
======================================================================
Status: OK
Accuracy: 76.33%

======================================================================
Overall Results (pred_min=60, k=4, N=15)
======================================================================
Status: OK
Accuracy: 77.05%

======================================================================
BEST RESULT for 60 min
======================================================================
Configuration: k=1, N=3
Accuracy: 78.47%
