======================================================================
Model 4 Test Results - 45 Minute Predictions
Generated: 2026-01-30 22:36:02
======================================================================

Accuracy Matrix (k × N):
--------------------------------------------------
k \ N   N=1         N=3         N=5         N=10        N=15        
--------------------------------------------------
k=1     76.33%      77.94%      75.80%      77.58%      75.62%      
k=2     76.69%      76.16%      75.98%      75.62%      76.69%      
k=3     75.80%      76.33%      76.33%      75.62%      75.80%      
k=4     74.73%      77.22%      75.80%      75.62%      ---         
--------------------------------------------------

Detailed Results:
======================================================================

======================================================================
Overall Results (pred_min=45, k=1, N=1)
======================================================================
Status: OK
Accuracy: 76.33%

======================================================================
Overall Results (pred_min=45, k=1, N=3)
======================================================================
Status: OK
Accuracy: 77.94%

======================================================================
Overall Results (pred_min=45, k=1, N=5)
======================================================================
Status: OK
Accuracy: 75.80%

======================================================================
Overall Results (pred_min=45, k=1, N=10)
======================================================================
Status: OK
Accuracy: 77.58%

======================================================================
Overall Results (pred_min=45, k=1, N=15)
======================================================================
Status: OK
Accuracy: 75.62%

======================================================================
Overall Results (pred_min=45, k=2, N=1)
======================================================================
Status: OK
Accuracy: 76.69%

======================================================================
Overall Results (pred_min=45, k=2, N=3)
======================================================================
Status: OK
Accuracy: 76.16%

======================================================================
Overall Results (pred_min=45, k=2, N=5)
======================================================================
Status: OK
Accuracy: 75.98%

======================================================================
Overall Results (pred_min=45, k=2, N=10)
======================================================================
Status: OK
Accuracy: 75.62%

======================================================================
Overall Results (pred_min=45, k=2, N=15)
======================================================================
Status: OK
Accuracy: 76.69%

======================================================================
Overall Results (pred_min=45, k=3, N=1)
======================================================================
Status: OK
Accuracy: 75.80%

======================================================================
Overall Results (pred_min=45, k=3, N=3)
======================================================================
Status: OK
Accuracy: 76.33%

======================================================================
Overall Results (pred_min=45, k=3, N=5)
======================================================================
Status: OK
Accuracy: 76.33%

======================================================================
Overall Results (pred_min=45, k=3, N=10)
======================================================================
Status: OK
Accuracy: 75.62%

======================================================================
Overall Results (pred_min=45, k=3, N=15)
======================================================================
Status: OK
Accuracy: 75.80%

======================================================================
Overall Results (pred_min=45, k=4, N=1)
======================================================================
Status: OK
Accuracy: 74.73%

======================================================================
Overall Results (pred_min=45, k=4, N=3)
======================================================================
Status: OK
Accuracy: 77.22%

======================================================================
Overall Results (pred_min=45, k=4, N=5)
======================================================================
Status: OK
Accuracy: 75.80%

======================================================================
Overall Results (pred_min=45, k=4, N=10)
======================================================================
Status: OK
Accuracy: 75.62%

======================================================================
Overall Results (pred_min=45, k=4, N=15)
======================================================================
Status: MODEL_NOT_FOUND

======================================================================
BEST RESULT for 45 min
======================================================================
Configuration: k=1, N=3
Accuracy: 77.94%
