======================================================================
Model 4 Test Results - 90 Minute Predictions
Generated: 2026-01-30 22:36:02
======================================================================

Accuracy Matrix (k × N):
--------------------------------------------------
k \ N   N=1         N=3         N=5         N=10        N=15        
--------------------------------------------------
k=1     78.65%      77.22%      80.25%      79.00%      80.25%      
k=2     78.47%      78.83%      80.78%      79.72%      81.85%      
k=3     77.58%      79.18%      79.36%      80.60%      78.83%      
k=4     77.94%      77.94%      79.72%      79.54%      79.18%      
--------------------------------------------------

Detailed Results:
======================================================================

======================================================================
Overall Results (pred_min=90, k=1, N=1)
======================================================================
Status: OK
Accuracy: 78.65%

======================================================================
Overall Results (pred_min=90, k=1, N=3)
======================================================================
Status: OK
Accuracy: 77.22%

======================================================================
Overall Results (pred_min=90, k=1, N=5)
======================================================================
Status: OK
Accuracy: 80.25%

======================================================================
Overall Results (pred_min=90, k=1, N=10)
======================================================================
Status: OK
Accuracy: 79.00%

======================================================================
Overall Results (pred_min=90, k=1, N=15)
======================================================================
Status: OK
Accuracy: 80.25%

======================================================================
Overall Results (pred_min=90, k=2, N=1)
======================================================================
Status: OK
Accuracy: 78.47%

======================================================================
Overall Results (pred_min=90, k=2, N=3)
======================================================================
Status: OK
Accuracy: 78.83%

======================================================================
Overall Results (pred_min=90, k=2, N=5)
======================================================================
Status: OK
Accuracy: 80.78%

======================================================================
Overall Results (pred_min=90, k=2, N=10)
======================================================================
Status: OK
Accuracy: 79.72%

======================================================================
Overall Results (pred_min=90, k=2, N=15)
======================================================================
Status: OK
Accuracy: 81.85%

======================================================================
Overall Results (pred_min=90, k=3, N=1)
======================================================================
Status: OK
Accuracy: 77.58%

======================================================================
Overall Results (pred_min=90, k=3, N=3)
======================================================================
Status: OK
Accuracy: 79.18%

======================================================================
Overall Results (pred_min=90, k=3, N=5)
======================================================================
Status: OK
Accuracy: 79.36%

======================================================================
Overall Results (pred_min=90, k=3, N=10)
======================================================================
Status: OK
Accuracy: 80.60%

======================================================================
Overall Results (pred_min=90, k=3, N=15)
======================================================================
Status: OK
Accuracy: 78.83%

======================================================================
Overall Results (pred_min=90, k=4, N=1)
======================================================================
Status: OK
Accuracy: 77.94%

======================================================================
Overall Results (pred_min=90, k=4, N=3)
======================================================================
Status: OK
Accuracy: 77.94%

======================================================================
Overall Results (pred_min=90, k=4, N=5)
======================================================================
Status: OK
Accuracy: 79.72%

======================================================================
Overall Results (pred_min=90, k=4, N=10)
======================================================================
Status: OK
Accuracy: 79.54%

======================================================================
Overall Results (pred_min=90, k=4, N=15)
======================================================================
Status: OK
Accuracy: 79.18%

======================================================================
BEST RESULT for 90 min
======================================================================
Configuration: k=2, N=15
Accuracy: 81.85%
